{"$schema":"https://json-schema.org/draft/2020-12/schema","$id":"urn:unclaimed-platform:schema:property-type-semantic-verification-execution:1.0.0","title":"PropertyTypeSemanticVerificationExecution","type":"object","additionalProperties":false,"required":["schema_version","execution_id","proposal_id","source_id","source_segment_id","jurisdiction","execution_approval_ref","privacy_approval_ref","executed_at","target","controls","transport_verification","requests_summary","sample_summary","safety_state","semantic_result_status","stop_reason"],"properties":{"schema_version":{"const":"1.0.0"},"execution_id":{"type":"string","minLength":1,"maxLength":160},"proposal_id":{"const":"ca.sco.segment.500_plus.property_type_semantic_verification"},"source_id":{"const":"ca.sco.unclaimed_property.bulk"},"source_segment_id":{"const":"ca.sco.unclaimed_property.bulk.500_plus"},"jurisdiction":{"const":"CA"},"execution_approval_ref":{"type":"string","minLength":1,"maxLength":256},"privacy_approval_ref":{"type":"string","minLength":1,"maxLength":256},"executed_at":{"type":"string","format":"date-time"},"target":{"type":"object","additionalProperties":false,"required":["endpoint","expected_content_length","expected_etag","expected_media_type","expected_accept_ranges"],"properties":{"endpoint":{"const":"https://claimit.ca.gov/upd-property-records/04_From_500_To_Beyond.zip"},"expected_content_length":{"const":162416884},"expected_etag":{"const":"\"b25b315b6cd8007624387c3a00d4b1fe\""},"expected_media_type":{"const":"application/zip"},"expected_accept_ranges":{"const":"bytes"}}},"controls":{"type":"object","additionalProperties":false,"required":["rows_max_per_member","rows_max_total","head_requests_max","range_requests_max","http_requests_max_total","range_response_bytes_max_each","total_source_response_body_bytes_max","uncompressed_transient_bytes_max_each","uncompressed_transient_bytes_max_total","logical_record_bytes_max","full_body_fallback_allowed","additional_range_allowed"],"properties":{"rows_max_per_member":{"const":4},"rows_max_total":{"const":16},"head_requests_max":{"const":1},"range_requests_max":{"const":4},"http_requests_max_total":{"const":5},"range_response_bytes_max_each":{"const":131072},"total_source_response_body_bytes_max":{"const":524288},"uncompressed_transient_bytes_max_each":{"const":262144},"uncompressed_transient_bytes_max_total":{"const":1048576},"logical_record_bytes_max":{"const":32768},"full_body_fallback_allowed":{"const":false},"additional_range_allowed":{"const":false}}},"transport_verification":{"type":"object","additionalProperties":false,"required":["head_performed","head_status","content_length","content_type","accept_ranges","etag","last_modified"],"properties":{"head_performed":{"type":"boolean"},"head_status":{"type":["integer","null"],"minimum":100,"maximum":599},"content_length":{"type":["integer","null"],"minimum":0},"content_type":{"type":["string","null"],"maxLength":128},"accept_ranges":{"type":["string","null"],"maxLength":64},"etag":{"type":["string","null"],"maxLength":256},"last_modified":{"type":["string","null"],"maxLength":128}}},"requests_summary":{"type":"object","additionalProperties":false,"required":["head_requests","range_requests","http_requests_total","total_body_bytes_read"],"properties":{"head_requests":{"type":"integer","minimum":0,"maximum":1},"range_requests":{"type":"integer","minimum":0,"maximum":4},"http_requests_total":{"type":"integer","minimum":0,"maximum":5},"total_body_bytes_read":{"type":"integer","minimum":0,"maximum":524288}}},"sample_summary":{"type":"object","additionalProperties":false,"required":["sample_rows_examined","rows_examined_per_member","distinct_property_type_codes","distinct_insurance_codes"],"properties":{"sample_rows_examined":{"type":"integer","minimum":0,"maximum":16},"rows_examined_per_member":{"type":"object","additionalProperties":false,"required":["From_500_To_Beyond_1_of_4.csv","From_500_To_Beyond_2_of_4.csv","From_500_To_Beyond_3_of_4.csv","From_500_To_Beyond_4_of_4.csv"],"properties":{"From_500_To_Beyond_1_of_4.csv":{"type":"integer","minimum":0,"maximum":4},"From_500_To_Beyond_2_of_4.csv":{"type":"integer","minimum":0,"maximum":4},"From_500_To_Beyond_3_of_4.csv":{"type":"integer","minimum":0,"maximum":4},"From_500_To_Beyond_4_of_4.csv":{"type":"integer","minimum":0,"maximum":4}}},"distinct_property_type_codes":{"type":"array","uniqueItems":true,"maxItems":16,"items":{"type":"string","pattern":"^(?:[A-Z]{2}[0-9]{2}|ZZZZ)$"}},"distinct_insurance_codes":{"type":"array","uniqueItems":true,"maxItems":9,"items":{"enum":["IN01","IN02","IN03","IN04","IN05","IN06","IN07","IN08","IN99"]}}}},"safety_state":{"type":"object","additionalProperties":false,"required":["full_archive_downloaded","raw_body_persisted","temporary_source_files_created","full_rows_persisted","property_id_persisted","per_row_property_type_persisted","owner_holder_values_persisted","identity_resolution_performed","beneficiary_matching_performed","outreach_performed","production_classification_activated"],"properties":{"full_archive_downloaded":{"const":false},"raw_body_persisted":{"const":false},"temporary_source_files_created":{"const":false},"full_rows_persisted":{"const":false},"property_id_persisted":{"const":false},"per_row_property_type_persisted":{"const":false},"owner_holder_values_persisted":{"const":false},"identity_resolution_performed":{"const":false},"beneficiary_matching_performed":{"const":false},"outreach_performed":{"const":false},"production_classification_activated":{"const":false}}},"semantic_result_status":{"enum":["SAMPLE_COMPATIBLE_INSURANCE_CODE_OBSERVED","SAMPLE_CODE_SHAPE_COMPATIBLE_NO_INSURANCE_CODE_OBSERVED","STOPPED_FAIL_CLOSED"]},"stop_reason":{"anyOf":[{"type":"null"},{"enum":["TRANSPORT_METADATA_DRIFT","RANGE_RESPONSE_NOT_PARTIAL","CONTENT_RANGE_MISMATCH","CANONICAL_MEMBER_METADATA_MISMATCH","HEADER_MISMATCH","CSV_PARSE_ERROR","ROW_COLUMN_COUNT_MISMATCH","PROPERTY_TYPE_EMPTY","PROPERTY_TYPE_FORMAT_UNEXPECTED","UNRECOGNIZED_INSURANCE_PREFIX_CODE","LOGICAL_RECORD_LIMIT_EXCEEDED","UNCOMPRESSED_TRANSIENT_LIMIT_EXCEEDED","ROW_SAMPLE_INCOMPLETE_WITHIN_MEMBER_PREFIX_CAP","ROW_LIMIT_EXCEEDED","REQUEST_LIMIT_EXCEEDED","BYTE_BUDGET_EXCEEDED","PRIVACY_APPROVAL_MISSING","UNEXPECTED_RESPONSE_BODY_BEHAVIOR","RUNNER_INTERNAL_ERROR"]}]}},"allOf":[{"if":{"properties":{"semantic_result_status":{"const":"SAMPLE_COMPATIBLE_INSURANCE_CODE_OBSERVED"}},"required":["semantic_result_status"]},"then":{"properties":{"stop_reason":{"type":"null"},"transport_verification":{"properties":{"head_performed":{"const":true},"head_status":{"const":200},"content_length":{"const":162416884},"content_type":{"const":"application/zip"},"accept_ranges":{"const":"bytes"},"etag":{"const":"\"b25b315b6cd8007624387c3a00d4b1fe\""}}},"requests_summary":{"properties":{"head_requests":{"const":1},"range_requests":{"const":4},"http_requests_total":{"const":5},"total_body_bytes_read":{"minimum":1}}},"sample_summary":{"properties":{"sample_rows_examined":{"minimum":4},"rows_examined_per_member":{"properties":{"From_500_To_Beyond_1_of_4.csv":{"minimum":1},"From_500_To_Beyond_2_of_4.csv":{"minimum":1},"From_500_To_Beyond_3_of_4.csv":{"minimum":1},"From_500_To_Beyond_4_of_4.csv":{"minimum":1}}},"distinct_insurance_codes":{"minItems":1}}}}}},{"if":{"properties":{"semantic_result_status":{"const":"SAMPLE_CODE_SHAPE_COMPATIBLE_NO_INSURANCE_CODE_OBSERVED"}},"required":["semantic_result_status"]},"then":{"properties":{"stop_reason":{"type":"null"},"transport_verification":{"properties":{"head_performed":{"const":true},"head_status":{"const":200},"content_length":{"const":162416884},"content_type":{"const":"application/zip"},"accept_ranges":{"const":"bytes"},"etag":{"const":"\"b25b315b6cd8007624387c3a00d4b1fe\""}}},"requests_summary":{"properties":{"head_requests":{"const":1},"range_requests":{"const":4},"http_requests_total":{"const":5},"total_body_bytes_read":{"minimum":1}}},"sample_summary":{"properties":{"sample_rows_examined":{"minimum":4},"rows_examined_per_member":{"properties":{"From_500_To_Beyond_1_of_4.csv":{"minimum":1},"From_500_To_Beyond_2_of_4.csv":{"minimum":1},"From_500_To_Beyond_3_of_4.csv":{"minimum":1},"From_500_To_Beyond_4_of_4.csv":{"minimum":1}}},"distinct_insurance_codes":{"maxItems":0}}}}}},{"if":{"properties":{"semantic_result_status":{"const":"STOPPED_FAIL_CLOSED"}},"required":["semantic_result_status"]},"then":{"properties":{"stop_reason":{"not":{"type":"null"}}}}}]}
